[
  {
    "id": "C-0001",
    "name": "Orion XS 1400 DC-DC Battery Charger",
    "manufacturer": "Victron Energy",
    "model": "Orion XS 1400",
    "category": "dc-dc-charger",
    "status": "deferred",
    "reason": "Valid future DC-DC option, but v1 uses 120VAC charging plus solar MPPT and no DC-DC input.",
    "ratings": {
      "inputVoltageRangeV": "9-35",
      "outputVoltageAdjustRangeV": "10-35",
      "inputOutputCurrentSettingRangeA": "1-50",
      "maxConstantShortCircuitCurrentA": 50,
      "continuousOutputPowerAt40CW": 1400,
      "maxEfficiencyPercent": 98.5,
      "protectionCategory": "IP65",
      "maxCableCrossSection": "4 AWG / 21.2 mm2"
    },
    "installation": {
      "externalBatteryProtectionFuseA": "60-70",
      "minimumCableGaugeUnder5m": "6 AWG / 16 mm2",
      "minimumCableGauge5to10m": "4 AWG / 21.2 mm2",
      "mounting": "Vertical on non-flammable surface with terminals down",
      "coolingClearanceCm": 10,
      "strainReliefRequired": true,
      "chargerModeDefault": true
    },
    "sources": [
      {
        "label": "Victron Orion XS 1400 technical data",
        "url": "https://www.victronenergy.com/media/pg/Orion_XS_1400_DC-DC_Battery_Charger/en/technical-data.html"
      },
      {
        "label": "Victron Orion XS 1400 installation manual",
        "url": "https://www.victronenergy.com/media/pg/Orion_XS_1400_DC-DC_Battery_Charger/en/installation.html"
      }
    ]
  },
  {
    "id": "C-0002",
    "name": "Orion XS 12/12-50A DC-DC Battery Charger",
    "manufacturer": "Victron Energy",
    "model": "Orion XS 12/12-50A",
    "category": "dc-dc-charger",
    "status": "rejected",
    "reason": "Output voltage adjustment range is 10-17V, which cannot charge an 8S/24V LiFePO4 bank.",
    "ratings": {
      "inputVoltageRangeV": "9-17",
      "outputVoltageAdjustRangeV": "10-17",
      "inputOutputCurrentSettingRangeA": "1-50",
      "continuousOutputPowerAt40CW": 700
    },
    "sources": [
      {
        "label": "Victron Orion XS 12/12-50A technical data",
        "url": "https://www.victronenergy.com/media/pg/Orion_XS_12-12-50A_DC-DC_battery_charger/en/technical-data.html"
      }
    ]
  },
  {
    "id": "C-0003",
    "name": "Blue Smart IP22 Charger 24V 16A 120V",
    "manufacturer": "Victron Energy",
    "model": "Blue Smart IP22 24/16 120V",
    "category": "ac-charger",
    "status": "rejected",
    "reason": "Lower 24V/16A output than the selected 25A target; acceptable fallback but not v1 selected charger.",
    "ratings": {
      "nominalBatteryVoltageV": 24,
      "outputCurrentA": 16,
      "acInput": "120V",
      "chargeProfile": "LiFePO4 supported via VictronConnect / Li-ion mode"
    },
    "sources": [
      {
        "label": "Victron Blue Smart IP22 120V manual",
        "url": "https://www.victronenergy.com/media/pg/Blue_Smart_IP22_Charger_manual_120V/en/operation/charge-modes.html"
      }
    ]
  },
  {
    "id": "C-0004",
    "name": "Phoenix Smart IP43 Charger 24V 25A",
    "manufacturer": "Victron Energy",
    "model": "Phoenix Smart IP43 24/25",
    "category": "ac-charger",
    "status": "selected",
    "reason": "Selected 120VAC-to-24V LiFePO4 charger class for shore and Rivian 120V outlet charging; about 600W DC output.",
    "ratings": {
      "nominalBatteryVoltageV": 24,
      "outputCurrentA": 25,
      "acInput": "120-240V",
      "chargeProfile": "LiFePO4 compatible and programmable"
    },
    "sources": [
      {
        "label": "Victron Phoenix Smart IP43 Charger",
        "url": "https://www.victronenergy.com/chargers/phoenix-smart-ip43-charger"
      }
    ]
  },
  {
    "id": "C-0005",
    "name": "SmartSolar MPPT 100/30",
    "manufacturer": "Victron Energy",
    "model": "SmartSolar MPPT 100/30",
    "category": "solar-charge-controller",
    "status": "selected",
    "reason": "Selected MPPT for portable solar into 24V battery bus; supports 100V PV input and 30A battery charge current.",
    "ratings": {
      "maxPvVoltageV": 100,
      "maxBatteryChargeCurrentA": 30,
      "suitableBatteryVoltages": "12V and 24V",
      "targetPvPowerW": "200-500",
      "targetPvVmpV": "36-44",
      "targetPvColdVocMaxV": 75,
      "targetPvIscMaxA": 15
    },
    "sources": [
      {
        "label": "Victron SmartSolar MPPT 100/30 manual",
        "url": "https://www.victronenergy.com/media/pg/Manual_SmartSolar_MPPT_100-30__100-50/en/introduction.html"
      }
    ]
  },
  {
    "id": "C-0006",
    "name": "Anderson Powerpole PP45 Solar Input",
    "manufacturer": "Anderson Power",
    "model": "Powerpole PP45",
    "category": "solar-connector",
    "status": "selected",
    "reason": "Selected user-facing dock solar input to support portable-panel wiring while avoiding confusion with SB120 battery connectors.",
    "ratings": {
      "maxCurrentA": 45,
      "use": "PV input only",
      "requiresAdapter": "MC4-to-Powerpole for common panel leads"
    },
    "sources": []
  },
  {
    "id": "C-0007",
    "name": "JK-B2A8S20P Smart Active Balance BMS",
    "manufacturer": "JKBMS",
    "model": "JK-B2A8S20P",
    "category": "battery-management-system",
    "status": "selected",
    "reason": "Selected per-module BMS for 8S LiFePO4 modules; 200A hardware rating provides large margin over 50A operating target and 60A fuse.",
    "ratings": {
      "supportedLifepo4Series": "4S-8S",
      "continuousDischargeCurrentA": 200,
      "peakDischargeCurrentA": 350,
      "activeBalanceCurrentA": 2,
      "targetModuleCurrentA": 50,
      "moduleFuseA": 60,
      "initialDischargeOverCurrentA": "70-80",
      "initialChargeOverCurrentA": 40,
      "cellOverVoltageProtectV": 3.60,
      "cellOverVoltageRecoverV": 3.45,
      "cellUnderVoltageProtectV": 2.80,
      "cellUnderVoltageRecoverV": 3.00,
      "packChargeVoltageTargetV": "28.0-28.4",
      "chargeLowTempProtectC": 2,
      "chargeLowTempRecoverC": 5,
      "dischargeLowTempProtectC": -20,
      "dischargeLowTempRecoverC": -15,
      "chargeHighTempProtectC": 50,
      "chargeHighTempRecoverC": 45,
      "dischargeHighTempProtectC": 55,
      "dischargeHighTempRecoverC": 50,
      "balanceStartVoltageV": 3.45,
      "balanceDeltaMv": 15
    },
    "installation": {
      "quantityPerModule": 1,
      "temperatureSensors": "Two cell sensors per module: center-cell group and outside/end-cell group; BMS MOS temperature monitored separately",
      "serviceAccess": "Bluetooth plus wired JK display/service port"
    },
    "sources": [
      {
        "label": "JK-B1A8S20P / JK-B2A8S20P manual copy",
        "url": "https://energiepanda.com/jk-active-balance-bms-jk-b1a8s20p-jk-b2a8s20p-user-manual/"
      },
      {
        "label": "JK-B2A8S20P product listing",
        "url": "https://www.shop.jkbms.com/product/jk-b2a8s20p-200a-smart-bms-2a-active-balancer-12v-24v/"
      }
    ]
  },
  {
    "id": "C-0008",
    "name": "JLLN060 Class T Fuse",
    "manufacturer": "Littelfuse",
    "model": "JLLN060",
    "category": "module-fuse",
    "status": "selected",
    "reason": "Selected 60A module fuse with high DC interrupt margin for each removable LiFePO4 module.",
    "ratings": {
      "fuseClass": "Class T",
      "currentA": 60,
      "voltageDcV": 160,
      "interruptRatingDcA": 20000,
      "modulePlacement": "as close to pack positive as practical"
    },
    "sources": [
      {
        "label": "Littelfuse JLLN Class T fuse datasheet",
        "url": "https://www.littelfuse.com/products/fuses/industrial-power-fuses/class-t-fuses/jlln.aspx"
      }
    ]
  },
  {
    "id": "C-0009",
    "name": "LFT30060 Class T Fuse Holder",
    "manufacturer": "Littelfuse",
    "model": "LFT30060",
    "category": "module-fuse-holder",
    "status": "selected",
    "reason": "Selected holder family for 35A-60A Class T JLLN fuses; exact packaging to confirm in enclosure layout.",
    "ratings": {
      "fuseCompatibility": "Class T JLLN 35A-60A",
      "currentA": 60
    },
    "installation": {
      "requiresInsulatedCover": true,
      "serviceAccess": "Must be accessible without unpacking cell stack"
    },
    "sources": [
      {
        "label": "Littelfuse Class T fuse holders",
        "url": "https://www.littelfuse.com/products/fuse-blocks-fuseholders-and-fuse-accessories/fuse-blocks/class-t-fuse-blocks.aspx"
      }
    ]
  },
  {
    "id": "C-0010",
    "name": "Blue Sea 6006 m-Series On-Off Battery Switch",
    "manufacturer": "Blue Sea Systems",
    "model": "6006",
    "category": "module-service-disconnect",
    "status": "selected",
    "reason": "Selected compact manual module service disconnect; use as no-load isolator only, not normal load-break switch.",
    "ratings": {
      "continuousCurrentA": 300,
      "maxVoltageDcV": 48,
      "switchingRatingA": 25,
      "use": "no-load service isolation"
    },
    "installation": {
      "placement": "after module fuse on pack positive",
      "requiresInsulatedBoots": true,
      "serviceSequence": "Turn off loads and chargers, verify near-zero current, then open disconnect"
    },
    "sources": [
      {
        "label": "Blue Sea 6006 m-Series battery switch",
        "url": "https://www.bluesea.com/products/6006/m-Series_Mini_On-Off_Battery_Switch_with_Key_-_Red"
      }
    ]
  }
]
